{
  "schema_version": 1,
  "policy_version": "1.1.0",
  "severe_repetitions": 3,
  "cases": [
    {"id":"DES-001-positive","rule_id":"DES-001","dimension":"D1","kind":"positive","title":"Two growing collections are nested on every scheduled run","fixture":{"language":"go","before":"for _, changed := range changedIDs { process(changed) }","after":"for _, account := range allAccounts { for _, event := range allEvents { match(account, event) } }","facts":["The hourly production job reads 200000 accounts and 800000 events.","No index or bound exists and the previous incremental path completed within the schedule."]},"expected":{"semantic_result":"BLOCK","finding_count":1,"severity":"S3","trigger_confidence":"T3","evidence_level":"E2","verifier_result":"confirmed"}},
    {"id":"DES-001-counterexample","rule_id":"DES-001","dimension":"D1","kind":"counterexample","title":"Nested lookup has a strict tiny bound","fixture":{"language":"go","before":"match(primary, candidates)","after":"for _, role := range fixedRoles { for _, state := range fixedStates { compare(role, state) } }","facts":["fixedRoles and fixedStates are compile-time arrays with at most four elements each."]},"expected":{"semantic_result":"PASS","finding_count":0,"severity":"","trigger_confidence":"","evidence_level":"","verifier_result":"not_run"}},
    {"id":"DES-001-insufficient","rule_id":"DES-001","dimension":"D1","kind":"insufficient","title":"Nested collections lack production scale evidence","fixture":{"language":"go","before":"process(items)","after":"for _, left := range leftItems { for _, right := range rightItems { compare(left, right) } }","facts":["The collection limits and production schedule are not present in the repository."]},"expected":{"semantic_result":"MANUAL_REVIEW","finding_count":1,"severity":"S3","trigger_confidence":"T2","evidence_level":"E1","verifier_result":"not_run"}},

    {"id":"DES-002-positive","rule_id":"DES-002","dimension":"D1","kind":"positive","title":"Frequent job discards its incremental checkpoint","fixture":{"language":"go","before":"rows := loadAfter(checkpoint)","after":"rows := loadAllHistory()","facts":["The job runs every minute over a 500-million-row append-only table.","The changed path no longer reads or advances the existing checkpoint."]},"expected":{"semantic_result":"BLOCK","finding_count":1,"severity":"S3","trigger_confidence":"T3","evidence_level":"E2","verifier_result":"confirmed"}},
    {"id":"DES-002-counterexample","rule_id":"DES-002","dimension":"D1","kind":"counterexample","title":"Full validation scans a bounded configuration set","fixture":{"language":"go","before":"validate(changedRules)","after":"validate(allRules)","facts":["The schema enforces a maximum of 20 rules and validation runs only on configuration publication."]},"expected":{"semantic_result":"PASS","finding_count":0,"severity":"","trigger_confidence":"","evidence_level":"","verifier_result":"not_run"}},
    {"id":"DES-002-insufficient","rule_id":"DES-002","dimension":"D1","kind":"insufficient","title":"Full history scan has unknown frequency and size","fixture":{"language":"go","before":"loadAfter(cursor)","after":"loadAll()","facts":["Neither deployment schedule nor production row count is available."]},"expected":{"semantic_result":"MANUAL_REVIEW","finding_count":1,"severity":"S3","trigger_confidence":"T2","evidence_level":"E1","verifier_result":"not_run"}},

    {"id":"DES-003-positive","rule_id":"DES-003","dimension":"D1","kind":"positive","title":"One remote request is added per production record","fixture":{"language":"go","before":"client.BatchGet(ctx, ids)","after":"for _, id := range ids { client.Get(ctx, id) }","facts":["The production caller passes every active user and currently has 600000 users.","The client has no concurrency, pagination, or request-count bound."]},"expected":{"semantic_result":"BLOCK","finding_count":1,"severity":"S3","trigger_confidence":"T3","evidence_level":"E2","verifier_result":"confirmed"}},
    {"id":"DES-003-counterexample","rule_id":"DES-003","dimension":"D1","kind":"counterexample","title":"Remote calls reject inputs above a strict tiny bound","fixture":{"language":"go","before":"client.BatchGet(ctx, regions)","after":"for _, region := range regions { client.Get(ctx, region) }","facts":["SyncRegions rejects more than three regions before making a remote call and propagates the caller context."]},"expected":{"semantic_result":"PASS","finding_count":0,"severity":"","trigger_confidence":"","evidence_level":"","verifier_result":"not_run"}},
    {"id":"DES-003-insufficient","rule_id":"DES-003","dimension":"D1","kind":"insufficient","title":"Remote call loop has no proven production cardinality","fixture":{"language":"go","before":"client.BatchGet(ctx, ids)","after":"for _, id := range ids { client.Get(ctx, id) }","facts":["The repository does not establish the caller cardinality, rate limit, or completion deadline."]},"expected":{"semantic_result":"MANUAL_REVIEW","finding_count":1,"severity":"S3","trigger_confidence":"T2","evidence_level":"E1","verifier_result":"not_run"}},

    {"id":"DES-004-positive","rule_id":"DES-004","dimension":"D1","kind":"positive","title":"Checkout reads a stale non-authoritative analytics price","fixture":{"language":"go","before":"price := authoritative.Price(product)","after":"price := analytics.Price(product)","facts":["The approved source registry names the authoritative system of record and marks analytics reporting-only with up to 24 hours of lag.","The production checkout path charges a concrete divergent analytics value without authoritative fallback."]},"expected":{"semantic_result":"BLOCK","finding_count":1,"severity":"S3","trigger_confidence":"T3","evidence_level":"E2","verifier_result":"confirmed"}},
    {"id":"DES-004-counterexample","rule_id":"DES-004","dimension":"D1","kind":"counterexample","title":"Versioned cache always falls back to the authority","fixture":{"language":"go","before":"return primary.Get(id)","after":"if cache.Version(id)==wanted { return cache.Get(id) }; return primary.Get(id)","facts":["The cache key includes the authoritative version and misses synchronously fall back to primary."]},"expected":{"semantic_result":"PASS","finding_count":0,"severity":"","trigger_confidence":"","evidence_level":"","verifier_result":"not_run"}},
    {"id":"DES-004-insufficient","rule_id":"DES-004","dimension":"D1","kind":"insufficient","title":"Checkout price switches to a source with undocumented authority","fixture":{"language":"go","before":"price := sources.Primary.Price(product)","after":"price := sources.Secondary.Price(product)","facts":["The production checkout path charges the returned cents and the two sources may diverge, but their authority and fallback semantics are undocumented."]},"expected":{"semantic_result":"MANUAL_REVIEW","finding_count":1,"severity":"S3","trigger_confidence":"T2","evidence_level":"E1","verifier_result":"not_run"}},

    {"id":"DES-005-positive","rule_id":"DES-005","dimension":"D1","kind":"positive","title":"Unbounded tenant backfill moves into an HTTP request","fixture":{"language":"go","before":"queue.Enqueue(Backfill{Tenant:id})","after":"for rows.Next() { rebuild(rows.Row()) }","facts":["The public request handler now scans all tenant history synchronously.","Large production tenants have tens of millions of rows and the gateway timeout is 30 seconds."]},"expected":{"semantic_result":"BLOCK","finding_count":1,"severity":"S3","trigger_confidence":"T3","evidence_level":"E2","verifier_result":"confirmed"}},
    {"id":"DES-005-counterexample","rule_id":"DES-005","dimension":"D1","kind":"counterexample","title":"Synchronous work is strictly bounded by request schema","fixture":{"language":"go","before":"validateOne(input)","after":"for _, item := range input.Items { validate(item) }","facts":["The request schema rejects more than five items and validation is CPU-local under the latency budget."]},"expected":{"semantic_result":"PASS","finding_count":0,"severity":"","trigger_confidence":"","evidence_level":"","verifier_result":"not_run"}},
    {"id":"DES-005-insufficient","rule_id":"DES-005","dimension":"D1","kind":"insufficient","title":"Request path adds local batch work with unknown limits","fixture":{"language":"go","before":"enqueueReindex(ids)","after":"rebuildEachIndex(ids)","facts":["The synchronous request now performs local CPU-and-disk index rebuilds, while item limits, production sizes, and the latency objective remain undocumented."]},"expected":{"semantic_result":"MANUAL_REVIEW","finding_count":1,"severity":"S3","trigger_confidence":"T2","evidence_level":"E1","verifier_result":"not_run"}},

    {"id":"COR-001-positive","rule_id":"COR-001","dimension":"D2","kind":"positive","title":"Refund implementation contradicts the approved contract","fixture":{"language":"go","before":"if age <= 30*day { refund() }","after":"if age < 7*day { refund() }","facts":["The versioned public contract requires refunds through day 30 inclusive.","A day-20 request reaches this changed production branch and is denied across a 50000-refund daily path with no manual override."]},"expected":{"semantic_result":"BLOCK","finding_count":1,"severity":"S3","trigger_confidence":"T3","evidence_level":"E2","verifier_result":"confirmed"}},
    {"id":"COR-001-counterexample","rule_id":"COR-001","dimension":"D2","kind":"counterexample","title":"Implementation follows the explicit versioned contract","fixture":{"language":"go","before":"legacyRule(input)","after":"return contractV2.Evaluate(input)","facts":["The caller selects contract v2 and the implementation matches every documented v2 branch."]},"expected":{"semantic_result":"PASS","finding_count":0,"severity":"","trigger_confidence":"","evidence_level":"","verifier_result":"not_run"}},